{
  "schemaVersion": 1,
  "syncAt": "2026-08-26T13:43:59.774Z",
  "source": "smartedu-syncClassroom",
  "editions": [
    {
      "editionId": "94fd350b9d6eb5c59dbee5ca49071c07",
      "stageId": "e7bbce2c-0590-11ed-9c79-92fc3b3249d5",
      "stageLabel": "初中",
      "gradeId": "44bec67a-54e6-11ed-9c34-850ba61fa9f4",
      "gradeLabel": "八年级",
      "subjectId": "e7bbcfee-0590-11ed-9c79-92fc3b3249d5",
      "subjectLabel": "物理",
      "versionId": "ff8080814371757b01437c363a187b0a",
      "versionLabel": "人教版",
      "volumeId": "ff8080814371757b014390f883db0453",
      "volumeLabel": "上册",
      "platformTag": "e7bbce2c-0590-11ed-9c79-92fc3b3249d5/44bec67a-54e6-11ed-9c34-850ba61fa9f4/e7bbcfee-0590-11ed-9c79-92fc3b3249d5/ff8080814371757b01437c363a187b0a/ff8080814371757b014390f883db0453",
      "platformTagPath": [
        {
          "level": "stage",
          "tagId": "e7bbce2c-0590-11ed-9c79-92fc3b3249d5",
          "label": "初中"
        },
        {
          "level": "grade",
          "tagId": "44bec67a-54e6-11ed-9c34-850ba61fa9f4",
          "label": "八年级"
        },
        {
          "level": "subject",
          "tagId": "e7bbcfee-0590-11ed-9c79-92fc3b3249d5",
          "label": "物理"
        },
        {
          "level": "version",
          "tagId": "ff8080814371757b01437c363a187b0a",
          "label": "人教版"
        },
        {
          "level": "volume",
          "tagId": "ff8080814371757b014390f883db0453",
          "label": "上册"
        }
      ],
      "online": true,
      "sourceUrl": "https://basic.smartedu.cn/syncClassroom?defaultTag=e7bbce2c-0590-11ed-9c79-92fc3b3249d5%2F44bec67a-54e6-11ed-9c34-850ba61fa9f4%2Fe7bbcfee-0590-11ed-9c79-92fc3b3249d5%2Fff8080814371757b01437c363a187b0a%2Fff8080814371757b014390f883db0453",
      "chapters": [
        {
          "chapterId": "ea4ac7da-eae7-4fca-b313-28d6b5d96f31",
          "chapterLabel": "序言",
          "chapterOrder": 1,
          "lessons": [
            {
              "lessonId": "5c2b033d2d111cdf2f8f1ab378cdf45e",
              "lessonLabel": "探索物理 科学之旅",
              "lessonOrder": 1,
              "platformTag": "e7bbce2c-0590-11ed-9c79-92fc3b3249d5/44bec67a-54e6-11ed-9c34-850ba61fa9f4/e7bbcfee-0590-11ed-9c79-92fc3b3249d5/ff8080814371757b01437c363a187b0a/ff8080814371757b014390f883db0453/ea4ac7da-eae7-4fca-b313-28d6b5d96f31/b1b1b189-4f0e-45b9-ace6-f9c307191d26",
              "platformTagPath": [
                {
                  "level": "stage",
                  "tagId": "e7bbce2c-0590-11ed-9c79-92fc3b3249d5",
                  "label": "初中"
                },
                {
                  "level": "grade",
                  "tagId": "44bec67a-54e6-11ed-9c34-850ba61fa9f4",
                  "label": "八年级"
                },
                {
                  "level": "subject",
                  "tagId": "e7bbcfee-0590-11ed-9c79-92fc3b3249d5",
                  "label": "物理"
                },
                {
                  "level": "version",
                  "tagId": "ff8080814371757b01437c363a187b0a",
                  "label": "人教版"
                },
                {
                  "level": "volume",
                  "tagId": "ff8080814371757b014390f883db0453",
                  "label": "上册"
                },
                {
                  "level": "chapter",
                  "tagId": "ea4ac7da-eae7-4fca-b313-28d6b5d96f31",
                  "label": "序言"
                },
                {
                  "level": "lesson",
                  "tagId": "b1b1b189-4f0e-45b9-ace6-f9c307191d26",
                  "label": "探索物理 科学之旅"
                }
              ],
              "sortKey": "001_001"
            }
          ]
        },
        {
          "chapterId": "a5acd519-f3ed-4f43-a9e4-cc2fe9ad44c9",
          "chapterLabel": "第一章 机械运动",
          "chapterOrder": 2,
          "lessons": [
            {
              "lessonId": "0a593ff8ba07939e284b11bc38fce0a5",
              "lessonLabel": "长度和时间的测量",
              "lessonOrder": 1,
              "platformTag": "e7bbce2c-0590-11ed-9c79-92fc3b3249d5/44bec67a-54e6-11ed-9c34-850ba61fa9f4/e7bbcfee-0590-11ed-9c79-92fc3b3249d5/ff8080814371757b01437c363a187b0a/ff8080814371757b014390f883db0453/a5acd519-f3ed-4f43-a9e4-cc2fe9ad44c9/c467ccc3-e63c-4ed1-b263-6ace2dd3b25c",
              "platformTagPath": [
                {
                  "level": "stage",
                  "tagId": "e7bbce2c-0590-11ed-9c79-92fc3b3249d5",
                  "label": "初中"
                },
                {
                  "level": "grade",
                  "tagId": "44bec67a-54e6-11ed-9c34-850ba61fa9f4",
                  "label": "八年级"
                },
                {
                  "level": "subject",
                  "tagId": "e7bbcfee-0590-11ed-9c79-92fc3b3249d5",
                  "label": "物理"
                },
                {
                  "level": "version",
                  "tagId": "ff8080814371757b01437c363a187b0a",
                  "label": "人教版"
                },
                {
                  "level": "volume",
                  "tagId": "ff8080814371757b014390f883db0453",
                  "label": "上册"
                },
                {
                  "level": "chapter",
                  "tagId": "a5acd519-f3ed-4f43-a9e4-cc2fe9ad44c9",
                  "label": "第一章 机械运动"
                },
                {
                  "level": "lesson",
                  "tagId": "c467ccc3-e63c-4ed1-b263-6ace2dd3b25c",
                  "label": "长度和时间的测量"
                }
              ],
              "sortKey": "002_001"
            },
            {
              "lessonId": "9676d31d631f14a9144d96a76be9bbe3",
              "lessonLabel": "运动的描述",
              "lessonOrder": 2,
              "platformTag": "e7bbce2c-0590-11ed-9c79-92fc3b3249d5/44bec67a-54e6-11ed-9c34-850ba61fa9f4/e7bbcfee-0590-11ed-9c79-92fc3b3249d5/ff8080814371757b01437c363a187b0a/ff8080814371757b014390f883db0453/a5acd519-f3ed-4f43-a9e4-cc2fe9ad44c9/1bb3ed41-866e-485d-bf6f-6ece7e353bb8",
              "platformTagPath": [
                {
                  "level": "stage",
                  "tagId": "e7bbce2c-0590-11ed-9c79-92fc3b3249d5",
                  "label": "初中"
                },
                {
                  "level": "grade",
                  "tagId": "44bec67a-54e6-11ed-9c34-850ba61fa9f4",
                  "label": "八年级"
                },
                {
                  "level": "subject",
                  "tagId": "e7bbcfee-0590-11ed-9c79-92fc3b3249d5",
                  "label": "物理"
                },
                {
                  "level": "version",
                  "tagId": "ff8080814371757b01437c363a187b0a",
                  "label": "人教版"
                },
                {
                  "level": "volume",
                  "tagId": "ff8080814371757b014390f883db0453",
                  "label": "上册"
                },
                {
                  "level": "chapter",
                  "tagId": "a5acd519-f3ed-4f43-a9e4-cc2fe9ad44c9",
                  "label": "第一章 机械运动"
                },
                {
                  "level": "lesson",
                  "tagId": "1bb3ed41-866e-485d-bf6f-6ece7e353bb8",
                  "label": "运动的描述"
                }
              ],
              "sortKey": "002_002"
            },
            {
              "lessonId": "f7d28cde1deac48cedfea22d3f74d674",
              "lessonLabel": "运动的快慢（第一课时）",
              "lessonOrder": 3,
              "platformTag": "e7bbce2c-0590-11ed-9c79-92fc3b3249d5/44bec67a-54e6-11ed-9c34-850ba61fa9f4/e7bbcfee-0590-11ed-9c79-92fc3b3249d5/ff8080814371757b01437c363a187b0a/ff8080814371757b014390f883db0453/a5acd519-f3ed-4f43-a9e4-cc2fe9ad44c9/24544684-6d09-4bc0-99cf-0b30dcdc3065",
              "platformTagPath": [
                {
                  "level": "stage",
                  "tagId": "e7bbce2c-0590-11ed-9c79-92fc3b3249d5",
                  "label": "初中"
                },
                {
                  "level": "grade",
                  "tagId": "44bec67a-54e6-11ed-9c34-850ba61fa9f4",
                  "label": "八年级"
                },
                {
                  "level": "subject",
                  "tagId": "e7bbcfee-0590-11ed-9c79-92fc3b3249d5",
                  "label": "物理"
                },
                {
                  "level": "version",
                  "tagId": "ff8080814371757b01437c363a187b0a",
                  "label": "人教版"
                },
                {
                  "level": "volume",
                  "tagId": "ff8080814371757b014390f883db0453",
                  "label": "上册"
                },
                {
                  "level": "chapter",
                  "tagId": "a5acd519-f3ed-4f43-a9e4-cc2fe9ad44c9",
                  "label": "第一章 机械运动"
                },
                {
                  "level": "lesson",
                  "tagId": "24544684-6d09-4bc0-99cf-0b30dcdc3065",
                  "label": "运动的快慢（第一课时）"
                }
              ],
              "sortKey": "002_003"
            },
            {
              "lessonId": "210ca10eef7afc495a075edbf646bf8c",
              "lessonLabel": "运动的快慢（第二课时）",
              "lessonOrder": 4,
              "platformTag": "e7bbce2c-0590-11ed-9c79-92fc3b3249d5/44bec67a-54e6-11ed-9c34-850ba61fa9f4/e7bbcfee-0590-11ed-9c79-92fc3b3249d5/ff8080814371757b01437c363a187b0a/ff8080814371757b014390f883db0453/a5acd519-f3ed-4f43-a9e4-cc2fe9ad44c9/b495a97f-1d03-4aa8-b322-e5d8c30e8aca",
              "platformTagPath": [
                {
                  "level": "stage",
                  "tagId": "e7bbce2c-0590-11ed-9c79-92fc3b3249d5",
                  "label": "初中"
                },
                {
                  "level": "grade",
                  "tagId": "44bec67a-54e6-11ed-9c34-850ba61fa9f4",
                  "label": "八年级"
                },
                {